{
  "id": "svp-2025-world-championship-deck-yuyu-okita-jp-raging-bolt",
  "region": "international",
  "set": "svp",
  "category": "battle_deck",
  "name": "2025 World Championship Deck: Yuyu Okita (JP Raging Bolt)",
  "contentsStatus": "partial",
  "contents": {
    "other": [
      {
        "name": "1x 2025 World Championships booklet",
        "count": 1
      },
      {
        "name": "1x 2025 World Champions-themed pin",
        "count": 1
      },
      {
        "name": "1x 2025 World Champions-themed coin",
        "count": 1
      },
      {
        "name": "1x 2025 World Champions-themed deck box",
        "count": 1
      },
      {
        "name": "1x paper playmat and poster",
        "count": 1
      },
      {
        "name": "1x code card for Pokémon Trading Card Game Live",
        "count": 1
      }
    ]
  },
  "notes": "Generated from TCGplayer's product text. Not resolved: a 60-card deck; deck list.",
  "releases": [
    {
      "language": "en",
      "name": "2025 World Championship Deck: Yuyu Okita (JP Raging Bolt)",
      "identifiers": {
        "tcgplayerProductIds": [
          696638
        ]
      },
      "sources": [
        "https://www.tcgplayer.com/product/696638/pokemon-world-championship-decks-2025-world-championship-deck-yuyu-okita-jp-raging-bolt"
      ]
    }
  ]
}
