{
  "id": "bw2-evolved-battle-action-tin-emboar",
  "region": "international",
  "set": "bw2",
  "category": "tin",
  "name": "Evolved Battle Action Tin [Emboar]",
  "contentsStatus": "partial",
  "contents": {},
  "notes": "Generated from TCGplayer's product text. The text states no contents.",
  "releases": [
    {
      "language": "en",
      "name": "Evolved Battle Action Tin [Emboar]",
      "identifiers": {
        "tcgplayerProductIds": [
          98624
        ]
      },
      "sources": [
        "https://www.tcgplayer.com/product/98624/pokemon-emerging-powers-evolved-battle-action-tin-emboar"
      ]
    }
  ]
}
