{
  "id": "sv08-booster-bundle-retail",
  "region": "international",
  "set": "sv08",
  "category": "booster_bundle",
  "name": "Surging Sparks Booster Bundle (Retail)",
  "contentsStatus": "complete",
  "contents": {
    "sealed": [
      {
        "product": "sv08-booster",
        "count": 6
      }
    ]
  },
  "notes": "Generated from TCGplayer's product text.",
  "releases": [
    {
      "language": "en",
      "name": "Surging Sparks Booster Bundle (Retail)",
      "identifiers": {
        "tcgplayerProductIds": [
          679564
        ]
      },
      "sources": [
        "https://www.tcgplayer.com/product/679564/pokemon-sv08-surging-sparks-surging-sparks-booster-bundle-retail"
      ]
    }
  ]
}
