{
  "id": "tk-ex-m-ex-trainer-kit-2",
  "region": "international",
  "set": "tk-ex-m",
  "category": "other",
  "name": "EX Trainer Kit 2 [Plusle & Minun]",
  "contentsStatus": "partial",
  "contents": {},
  "notes": "Generated from TCGplayer's product text. The text states no contents.",
  "releases": [
    {
      "language": "en",
      "name": "EX Trainer Kit 2 [Plusle & Minun]",
      "identifiers": {
        "tcgplayerProductIds": [
          98951
        ]
      },
      "sources": [
        "https://www.tcgplayer.com/product/98951/pokemon-ex-trainer-kit-2-plusle-and-minun-ex-trainer-kit-2-plusle-and-minun"
      ]
    }
  ]
}
