{
  "id": "swshp-pokemon-tcg-ex-collector-s-box-deoxys",
  "region": "international",
  "set": "swshp",
  "category": "collection_box",
  "name": "Pokemon TCG: EX Collector's Box [Deoxys]",
  "contentsStatus": "partial",
  "contents": {},
  "notes": "Generated from TCGplayer's product text. Not resolved: three booster packs; two POP Series 1 packs.",
  "releases": [
    {
      "language": "en",
      "name": "Pokemon TCG: EX Collector's Box [Deoxys]",
      "identifiers": {
        "tcgplayerProductIds": [
          210198
        ]
      },
      "sources": [
        "https://www.tcgplayer.com/product/210198/pokemon-miscellaneous-cards-and-products-pokemon-tcg-ex-collectors-box-deoxys"
      ]
    }
  ]
}
