{
  "id": "swshp-v-heroes-tin-set-of-3-international-version",
  "region": "international",
  "set": "swshp",
  "category": "other",
  "name": "V Heroes Tin [Set of 3] (International Version)",
  "contentsStatus": "partial",
  "contents": {},
  "notes": "Generated from TCGplayer's product text. Not resolved: 1 foil card featuring Sylveon V, Umbreon V, Espeon V (respectively); 4 Pokémon TCG booster packs; set of products.",
  "releases": [
    {
      "language": "en",
      "name": "V Heroes Tin [Set of 3] (International Version)",
      "identifiers": {
        "tcgplayerProductIds": [
          270154
        ]
      },
      "sources": [
        "https://www.tcgplayer.com/product/270154/pokemon-miscellaneous-cards-and-products-v-heroes-tin-set-of-3-international-version"
      ]
    }
  ]
}
