{
  "id": "cel25-deluxe-pin-collection-zacian-lv-x",
  "region": "international",
  "set": "cel25",
  "category": "collection_box",
  "name": "Celebrations Deluxe Pin Collection [Zacian LV. X]",
  "contentsStatus": "partial",
  "contents": {
    "sealed": [
      {
        "product": "cel25-booster-pack",
        "count": 4
      }
    ],
    "other": [
      {
        "name": "Enamel Pin Featuring Flying and Surfing Pikachu",
        "count": 1
      }
    ]
  },
  "notes": "Generated from TCGplayer's product text. Not resolved: One Foil Promo Card; Two Additional Pokemon TCG Booster Packs.",
  "releases": [
    {
      "language": "en",
      "name": "Celebrations Deluxe Pin Collection [Zacian LV. X]",
      "identifiers": {
        "tcgplayerProductIds": [
          242810
        ]
      },
      "sources": [
        "https://www.tcgplayer.com/product/242810/pokemon-celebrations-celebrations-deluxe-pin-collection-zacian-lv-x"
      ]
    }
  ]
}
