{
  "id": "sv04-single-pack-blister-ceruledge",
  "region": "international",
  "set": "sv04",
  "category": "blister",
  "name": "Paradox Rift Single Pack Blister [Ceruledge]",
  "contentsStatus": "partial",
  "contents": {
    "sealed": [
      {
        "product": "sv04-booster-pack",
        "count": 1
      }
    ]
  },
  "notes": "Generated from TCGplayer's product text. Not resolved: 1 coin, Charcadet and promotional card of Ceruledge.",
  "releases": [
    {
      "language": "en",
      "name": "Paradox Rift Single Pack Blister [Ceruledge]",
      "identifiers": {
        "tcgplayerProductIds": [
          625582
        ]
      },
      "sources": [
        "https://www.tcgplayer.com/product/625582/pokemon-sv04-paradox-rift-paradox-rift-single-pack-blister-ceruledge"
      ]
    }
  ]
}
