{
  "id": "xy8-pin-blisters-mega-mewtwo-set-of-2",
  "region": "international",
  "set": "xy8",
  "category": "other",
  "name": "BREAKthrough Pin Blisters [Mega Mewtwo] (Set of 2)",
  "contentsStatus": "partial",
  "contents": {},
  "notes": "Generated from TCGplayer's product text. The text states no contents.",
  "releases": [
    {
      "language": "en",
      "name": "BREAKthrough Pin Blisters [Mega Mewtwo] (Set of 2)",
      "identifiers": {
        "tcgplayerProductIds": [
          107110
        ]
      },
      "sources": [
        "https://www.tcgplayer.com/product/107110/pokemon-xy-breakthrough-breakthrough-pin-blisters-mega-mewtwo-set-of-2"
      ]
    }
  ]
}
