{
  "id": "swshp-rayquaza-v-noivern-v-battle-decks-set-of-2",
  "region": "international",
  "set": "swshp",
  "category": "other",
  "name": "Rayquaza V / Noivern V Battle Decks [Set of 2]",
  "contentsStatus": "partial",
  "contents": {},
  "notes": "Generated from TCGplayer's product text. Not resolved: 1 ready-to-play 60-card deck; set of products; deck list.",
  "releases": [
    {
      "language": "en",
      "name": "Rayquaza V / Noivern V Battle Decks [Set of 2]",
      "releaseDate": "2021-10-08",
      "identifiers": {
        "tcgplayerProductIds": [
          245731
        ]
      },
      "sources": [
        "https://www.tcgplayer.com/product/245731/pokemon-miscellaneous-cards-and-products-rayquaza-v-noivern-v-battle-decks-set-of-2"
      ]
    }
  ]
}
