{
  "id": "g1-mythical-pokemon-collection-box-jirachi",
  "region": "international",
  "set": "g1",
  "category": "collection_box",
  "name": "Mythical Pokemon Collection Box [Jirachi]",
  "contentsStatus": "partial",
  "contents": {},
  "notes": "Generated from TCGplayer's product text. The text states no contents.",
  "releases": [
    {
      "language": "en",
      "name": "Mythical Pokemon Collection Box [Jirachi]",
      "identifiers": {
        "tcgplayerProductIds": [
          116999
        ]
      },
      "sources": [
        "https://www.tcgplayer.com/product/116999/pokemon-generations-mythical-pokemon-collection-box-jirachi"
      ]
    }
  ]
}
