{
  "id": "smp-pokemon-poke-ball-tin-quick-ball",
  "region": "international",
  "set": "smp",
  "category": "tin",
  "name": "Pokemon - Poke Ball Tin - Quick Ball",
  "contentsStatus": "partial",
  "contents": {
    "other": [
      {
        "name": "Coin",
        "count": 1
      }
    ]
  },
  "notes": "Generated from TCGplayer's product text. Not resolved: three random Pokemon TCG booster packs.",
  "releases": [
    {
      "language": "en",
      "name": "Pokemon - Poke Ball Tin - Quick Ball",
      "identifiers": {
        "tcgplayerProductIds": [
          181268
        ]
      },
      "sources": [
        "https://www.tcgplayer.com/product/181268/pokemon-miscellaneous-cards-and-products-pokemon-poke-ball-tin-quick-ball"
      ]
    }
  ]
}
